<?xml version="1.0" encoding="UTF-8"?>
<!--
/**
 * Umc_Base extension
 *
 * NOTICE OF LICENSE
 *
 * This source file is subject to the MIT License
 * that is bundled with this package in the file LICENSE.txt.
 * It is also available through the world-wide-web at this URL:
 * http://opensource.org/licenses/mit-license.php
 *
 * @category  Umc
 * @package   Umc_Base
 * @copyright 2015 Marius Strajeru
 * @license   http://opensource.org/licenses/mit-license.php MIT License
 * @author    Marius Strajeru <ultimate.module.creator@gmail.com>
 */
-->
<xs:schema xmlns:xs="http://www.w3.org/2001/XMLSchema">
    <xs:element name="classes" type="classesType" />
    <xs:complexType name="classesType">
        <xs:sequence>
            <xs:element type="classType" name="class" maxOccurs="unbounded" minOccurs="0"/>
        </xs:sequence>
    </xs:complexType>

    <xs:complexType name="classType">
        <xs:annotation>
            <xs:documentation>Class declaration</xs:documentation>
        </xs:annotation>
        <xs:attribute type="xs:string" name="id" use="required"/>
        <xs:attribute type="xs:string" name="class" use="required"/>
        <xs:attribute type="xs:string" name="alias" use="optional"/>
    </xs:complexType>
</xs:schema>
